{
  "$schema": "https://json-schema.org/draft/2020-12/schema",
  "$id": "https://metheus.castalia.institute/schema/experience-pathway.schema.json",
  "title": "Metheus reflective experience pathway map",
  "description": "A subject-scoped graph of reported, measured, and interpretive episode elements. It is not a psychological assessment or causal model.",
  "type": "object",
  "additionalProperties": false,
  "required": ["id", "subjectId", "schemaVersion", "modelVersion", "dataStatus", "window", "nodes", "relations", "privacy", "limitations"],
  "properties": {
    "id": { "type": "string", "minLength": 1 },
    "subjectId": { "type": "string", "minLength": 1 },
    "schemaVersion": { "const": "0.1" },
    "modelVersion": { "type": "string", "minLength": 1 },
    "dataStatus": { "enum": ["synthetic_fixture", "subject_authored"] },
    "window": {
      "type": "object", "additionalProperties": false,
      "required": ["start", "end", "precision"],
      "properties": {
        "start": { "type": "string", "format": "date-time" },
        "end": { "type": "string", "format": "date-time" },
        "timeZone": { "type": "string" },
        "precision": { "enum": ["exact", "approximate", "unknown"] }
      }
    },
    "nodes": {
      "type": "array", "minItems": 1,
      "items": {
        "type": "object", "additionalProperties": false,
        "required": ["nodeId", "construct", "epistemicKind", "label", "basisRecordIds"],
        "properties": {
          "nodeId": { "type": "string", "minLength": 1 },
          "construct": { "enum": ["context", "situation", "noticed_cue", "appraisal", "perceived_stress", "emotion", "hostile_orientation", "bodily_sensation", "measured_response", "action_or_inhibition", "repetitive_thought", "coping_activity", "reported_aftereffect", "consequence", "suffering", "reappraisal", "reflection"] },
          "processKind": { "enum": ["rumination", "journaling", "venting_to_friend", "talking_with_ai_chatbot", "seeking_support", "problem_solving", "distraction", "withdrawal", "other", "unknown"] },
          "informationDisclosure": { "enum": ["not_recorded", "general_context", "personal", "sensitive", "unknown"], "description": "Optional subject report of the sensitivity of information shared in an interaction; not a transcript or service privacy assessment." },
          "epistemicKind": { "enum": ["person_reported", "caregiver_reported", "observed", "measured", "derived", "clinician_reported"] },
          "label": { "type": "string", "minLength": 1 },
          "basisRecordIds": { "type": "array", "items": { "type": "string", "minLength": 1 }, "minItems": 1, "uniqueItems": true },
          "timeReference": { "type": "string" },
          "notes": { "type": "string", "description": "Optional minimal context; sensitive narrative remains in its separately governed source record." }
        },
        "allOf": [
          { "if": { "properties": { "construct": { "const": "repetitive_thought" } }, "required": ["construct"] }, "then": { "required": ["processKind"], "properties": { "processKind": { "const": "rumination" } } } },
          { "if": { "properties": { "construct": { "const": "coping_activity" } }, "required": ["construct"] }, "then": { "required": ["processKind"], "properties": { "processKind": { "enum": ["journaling", "venting_to_friend", "talking_with_ai_chatbot", "seeking_support", "problem_solving", "distraction", "withdrawal", "other", "unknown"] } } } },
          { "if": { "properties": { "processKind": { "const": "talking_with_ai_chatbot" } }, "required": ["processKind"] }, "then": { "properties": { "informationDisclosure": { "enum": ["not_recorded", "general_context", "personal", "sensitive", "unknown"] } } } }
        ]
      }
    },
    "relations": {
      "type": "array",
      "items": {
        "type": "object", "additionalProperties": false,
        "required": ["relationId", "fromNodeId", "toNodeId", "relationType", "basis", "uncertainty"],
        "properties": {
          "relationId": { "type": "string", "minLength": 1 },
          "fromNodeId": { "type": "string", "minLength": 1 },
          "toNodeId": { "type": "string", "minLength": 1 },
          "relationType": { "enum": ["temporal_order", "co_occurrence", "person_reported_link", "literature_mechanism", "model_hypothesis", "reappraisal"] },
          "basis": { "enum": ["record_times", "person_report", "cited_evidence", "explicit_hypothesis"] },
          "basisRecordIds": { "type": "array", "items": { "type": "string", "minLength": 1 }, "uniqueItems": true },
          "evidenceClaimIds": { "type": "array", "items": { "type": "string", "minLength": 1 }, "uniqueItems": true },
          "uncertainty": { "enum": ["low", "moderate", "high", "unknown"] },
          "notes": { "type": "string" }
        },
        "allOf": [
          { "if": { "properties": { "relationType": { "const": "temporal_order" } }, "required": ["relationType"] }, "then": { "required": ["basisRecordIds"], "properties": { "basis": { "const": "record_times" }, "basisRecordIds": { "minItems": 2 } } } },
          { "if": { "properties": { "relationType": { "const": "co_occurrence" } }, "required": ["relationType"] }, "then": { "required": ["basisRecordIds"], "properties": { "basis": { "const": "record_times" }, "basisRecordIds": { "minItems": 2 } } } },
          { "if": { "properties": { "relationType": { "const": "person_reported_link" } }, "required": ["relationType"] }, "then": { "required": ["basisRecordIds"], "properties": { "basis": { "const": "person_report" }, "basisRecordIds": { "minItems": 1 } } } },
          { "if": { "properties": { "relationType": { "const": "literature_mechanism" } }, "required": ["relationType"] }, "then": { "required": ["evidenceClaimIds"], "properties": { "basis": { "const": "cited_evidence" }, "evidenceClaimIds": { "minItems": 1 } } } },
          { "if": { "properties": { "relationType": { "const": "model_hypothesis" } }, "required": ["relationType"] }, "then": { "required": ["basisRecordIds"], "properties": { "basis": { "const": "explicit_hypothesis" }, "basisRecordIds": { "minItems": 1 } } } },
          { "if": { "properties": { "relationType": { "const": "reappraisal" } }, "required": ["relationType"] }, "then": { "required": ["basisRecordIds"], "properties": { "basis": { "const": "person_report" }, "basisRecordIds": { "minItems": 1 } } } }
        ]
      }
    },
    "privacy": {
      "type": "object", "additionalProperties": false,
      "required": ["sensitivity", "subjectControlled", "sharing"],
      "properties": {
        "sensitivity": { "enum": ["personal", "sensitive", "highly_sensitive"] },
        "subjectControlled": { "const": true },
        "sharing": { "enum": ["private", "explicitly_shared"] }
      }
    },
    "limitations": { "type": "array", "items": { "type": "string", "minLength": 1 }, "minItems": 1 }
  }
}
